{
  "status": "DRAFT_NO_AUTHORITY",
  "non_authority_statement": "This file is a set of drafts. It is not an authority, it binds nothing and it must not be cited as a decision.",
  "drafting_frame": {
    "requires_explicit_controlled_rule": true,
    "absence_of_evidence_is_not_not_applicable": true,
    "unknown_is_not_not_applicable": true,
    "decision_states": [
      "RULE_PUBLISHED",
      "NO_RULE_WILL_BE_PUBLISHED",
      "NOT_YET_DECIDED"
    ],
    "condition_states": [
      "KNOWN_TRUE",
      "KNOWN_FALSE"
    ],
    "condition_combination": "ALL_CONDITIONS_MUST_MATCH",
    "min_conditions": 1,
    "field_may_appear_once": true,
    "rule_condition_fields": [
      "production",
      "internet_exposed",
      "contains_customer_data",
      "ai_enabled"
    ],
    "fields_not_usable_in_rules": [
      "owner",
      "tier",
      "service_criticality",
      "data_classification"
    ],
    "fields_not_usable_in_rules_statement": "owner, tier, service_criticality and data_classification are declared classification fields that are not usable in rules in this version.",
    "field_definitions": {
      "production": "KNOWN_TRUE asserts that the target is used as, or supports, a production system, so production-data, recovery and release controls are in play.",
      "internet_exposed": "KNOWN_TRUE asserts that the target, or a service it provides, is reachable from the public internet.",
      "contains_customer_data": "KNOWN_TRUE asserts that the target holds or processes customer data.",
      "ai_enabled": "KNOWN_TRUE asserts that the target includes or uses AI capabilities, so AI-specific controls apply to it."
    },
    "resolution": [
      {
        "decision_state": "NOT_YET_DECIDED",
        "condition": "ALWAYS",
        "result": "APPLICABILITY_UNRESOLVED"
      },
      {
        "decision_state": "NO_RULE_WILL_BE_PUBLISHED",
        "condition": "ALWAYS",
        "result": "APPLICABLE"
      },
      {
        "decision_state": "RULE_PUBLISHED",
        "condition": "ALL_NAMED_FIELDS_KNOWN_AND_ALL_CONDITIONS_MET",
        "result": "NOT_APPLICABLE"
      },
      {
        "decision_state": "RULE_PUBLISHED",
        "condition": "ALL_NAMED_FIELDS_KNOWN_AND_NOT_ALL_CONDITIONS_MET",
        "result": "APPLICABLE"
      },
      {
        "decision_state": "RULE_PUBLISHED",
        "condition": "ANY_NAMED_FIELD_UNKNOWN",
        "result": "APPLICABILITY_UNRESOLVED"
      }
    ],
    "no_short_circuit": true,
    "decision_state_governs_resolved_result": true,
    "per_control_default_describes_result_absent_a_decision": true,
    "unknown_is_never_not_applicable": true,
    "statements": [
      "A not_applicable_rule is a flat list of conditions and all conditions must match.",
      "When every field named by a published rule is known and every condition is met, the result is NOT_APPLICABLE.",
      "When every field named by a published rule is known and not every condition is met, the result is APPLICABLE.",
      "NO_RULE_WILL_BE_PUBLISHED resolves to APPLICABLE for every target whatever the facts.",
      "NOT_YET_DECIDED resolves to APPLICABILITY_UNRESOLVED.",
      "When any field named by a published rule is UNKNOWN the result is APPLICABILITY_UNRESOLVED, even when another named field already fails its condition.",
      "UNKNOWN never yields NOT_APPLICABLE.",
      "The not_applicable_decision_state governs the resolved result; default_applicability_result describes the result absent a decision."
    ]
  },
  "catalog_source": {
    "relative_path": "registry/control_catalog.yaml",
    "git_blob_id": "03c9faa44af37860fe268a74bcb4468e8bfd34c4",
    "sha256": "12bb1a9d2476e4b0208ff51f9296f51462395f01af8d0543ad3c7eae9f039477",
    "entries_have_description": false,
    "note": "None of the 21 requested catalog entries carries a description, and the catalog seed rationale field is boilerplate, not a definition."
  },
  "proposals": [
    {
      "control_id": "EMS-CTRL-009",
      "proposed_outcome": "PROPOSE_NO_RULE",
      "proposed_rule": null,
      "catalog_inputs": {
        "control_name": "Branch Protection Required",
        "scope": "REPOSITORY",
        "scope_owner": "Software Development",
        "evidence_authority": "Repository evidence"
      },
      "interpretation": {
        "label": "DRAFTER_ASSUMPTION_NOT_AN_EMS_SOURCE",
        "text": "The important branches of the repository are configured so that direct pushes, forced pushes and deletion are blocked and changes must pass defined gates before they land."
      },
      "rationale": "Branch protection is a configuration of the repository itself that guards branch history against direct or forced changes, so it follows the repository and not any deployment fact. None of production, internet_exposed, contains_customer_data or ai_enabled says whether a repository has branch history worth protecting, so none of them gives a sound exemption. Proposing no rule claims that branch protection applies to every archived repository snapshot, and the frozen nature of a snapshot cannot be expressed with the four usable fields.",
      "confidence": "HIGH",
      "alternative_considered": {
        "outcome": "PROPOSE_RULE",
        "why": "A rule on production KNOWN_FALSE was rejected because the control name does not point at production and a repository that supports no production system still needs its branch history guarded."
      },
      "shape_limitation": null
    },
    {
      "control_id": "EMS-CTRL-010",
      "proposed_outcome": "PROPOSE_NO_RULE",
      "proposed_rule": null,
      "catalog_inputs": {
        "control_name": "Pull Request Review",
        "scope": "REPOSITORY",
        "scope_owner": "Software Development",
        "evidence_authority": "Repository evidence"
      },
      "interpretation": {
        "label": "DRAFTER_ASSUMPTION_NOT_AN_EMS_SOURCE",
        "text": "Changes enter the repository through pull requests that are approved by at least one reviewer other than the author before merge."
      },
      "rationale": "Pull request review is a practice about how changes are accepted into a repository, and the evidence for it lives in the merge history that a snapshot still carries. Whether the target is production, internet exposed, holds customer data or is AI enabled does not change whether its changes should have been reviewed, so none of the four fields gives a sound exemption. Proposing no rule therefore claims that pull request review applies to every archived repository snapshot.",
      "confidence": "HIGH",
      "alternative_considered": {
        "outcome": "PROPOSE_RULE",
        "why": "A rule on production KNOWN_FALSE was rejected because it would be a guess that review only matters for production code, and the control name does not point at any usable field."
      },
      "shape_limitation": null
    },
    {
      "control_id": "EMS-CTRL-011",
      "proposed_outcome": "PROPOSE_NO_RULE",
      "proposed_rule": null,
      "catalog_inputs": {
        "control_name": "CODEOWNERS Enforcement",
        "scope": "REPOSITORY",
        "scope_owner": "Software Development",
        "evidence_authority": "Repository evidence"
      },
      "interpretation": {
        "label": "DRAFTER_ASSUMPTION_NOT_AN_EMS_SOURCE",
        "text": "The repository carries a CODEOWNERS file that assigns owners to paths, and review by those owners is enforced for changes to the paths they own."
      },
      "rationale": "CODEOWNERS enforcement is a repository practice that ties paths to accountable reviewers, and it is evidenced by a file and settings that belong to the repository. None of production, internet_exposed, contains_customer_data or ai_enabled describes whether a repository needs accountable path owners, so none of them gives a sound exemption. Proposing no rule claims that CODEOWNERS enforcement applies to every archived repository snapshot.",
      "confidence": "HIGH",
      "alternative_considered": {
        "outcome": "PROPOSE_RULE",
        "why": "The only field that sounds related is owner, which is a classification field that is not usable in rules in this version and does not describe code ownership of paths in any case."
      },
      "shape_limitation": null
    },
    {
      "control_id": "EMS-CTRL-012",
      "proposed_outcome": "PROPOSE_NO_RULE",
      "proposed_rule": null,
      "catalog_inputs": {
        "control_name": "Signed Commits",
        "scope": "REPOSITORY",
        "scope_owner": "Software Development",
        "evidence_authority": "Repository evidence"
      },
      "interpretation": {
        "label": "DRAFTER_ASSUMPTION_NOT_AN_EMS_SOURCE",
        "text": "Commits in the repository are cryptographically signed by their authors and the signatures can be verified."
      },
      "rationale": "Signed commits are a property of the commit history, and that history is exactly what an archived snapshot preserves and what a reader of the snapshot relies on for authorship. None of production, internet_exposed, contains_customer_data or ai_enabled bears on whether authorship of commits should be verifiable, so none of them gives a sound exemption. Proposing no rule claims that signed commits apply to every archived repository snapshot.",
      "confidence": "HIGH",
      "alternative_considered": null,
      "shape_limitation": null
    },
    {
      "control_id": "EMS-CTRL-013",
      "proposed_outcome": "PROPOSE_NO_RULE",
      "proposed_rule": null,
      "catalog_inputs": {
        "control_name": "Protected Release Tags",
        "scope": "REPOSITORY",
        "scope_owner": "Software Development",
        "evidence_authority": "Repository evidence"
      },
      "interpretation": {
        "label": "DRAFTER_ASSUMPTION_NOT_AN_EMS_SOURCE",
        "text": "Tags that mark released versions are protected so that they cannot be moved, overwritten or deleted by ordinary contributors."
      },